ID,titles
791,"Selon Closer, le hackeur présumé de Laura Smet aurait été interpellé le 9 mars par les enquêteurs de la Brigade de Répression de la Délin"
792,"Le second tour de l'élection présidentielle, qui s'est déroulé dimanche, a été reporté en raison de la pandémie de coronavirus."
793,Le gouvernement a annoncé de nouvelles mesures concernant le transport ce dimanche 15 mars.
794,Le chef de l'État s'est engagé à ce qu'aucun enfant sans solution de scolarisation ne puisse encore exister au mois de mars.
795,"Une centaine de globicéphales ont été sauvés dans la baie de Macquarie Harbour, en Tasmanie, le plus important échouage jamais enregistré en"
796,"Le ministre de l'Intérieur Christophe Castaner a rendu hommage aux policiers qui ""dans des conditions difficiles, subissent des menaces, des ré"
797,"L'incident s'est produit vendredi 13 juillet, vers 23h30."
798,"L'air du temps. Dans la fermeture de la poussière des frontières, dans le Val-d'Oise, la fermeture de la pouss"
799,"La jeune femme a été interpellée le 30 janvier dernier dans la station balnéaire de Karon, en Thaïlande."
800,Le collégien a eu le réflexe d'aller se réfugier dans une maison située à proximité avant d'appeler ses parents.
801,Le présentateur du 13 Heures de TF1 s'est confié au Journal du dimanche.
802,"L'animal est sorti en lisière de la forêt de Compiègne, samedi 19 septembre."
803,Un avion de tourisme a disparu en mer entre Nantes et Cardiff lundi vers 20 heures.
804,Les manifestants ont rendu hommage aux policiers morts ou blessés en service.
805,"L'émission ""Danse avec les stars"" sur TF1 a réuni l'ex-Miss France Iris Mittenaere et la candidate Elsa Esnoult."
806,"Le magazine ""Complément d'enquête"" s'est procuré le portrait de Jean-Jacques Goldman."
807,"Invité ce jeudi 24 mai sur BFMTV, le député de la Somme apparenté La France insoumise se voit comme un ""bon animateur de démocratie"" plutôt"
808,"Jean-François Copé a dénoncé lundi matin la politique de Laurent Wauquiez, à la tête du parti depuis décembre 2017."
809,"La garde à vue d'un homme interpellé à la suite du décès dans la nuit de vendredi à samedi 29 août de l'un des responsables du groupe Bonduelle,"
810,"Une fillette de 2,2 kg a été retrouvée samedi soir à Huttenheim (Bas-Rhin). Un client du restaurant a cru que c'était un chat."
811,"La Corée du Nord a pris des mesures drastiques, fermant ses frontières et imposant un confinement à des milliers de personnes."
812,"La secrétaire d'État à la Défense Geneviève Darrieussecq a annoncé samedi qu'elle allait ""présider"" une corrida à Dax"
813,"Le cimetière de Beykoz, dans l'est de la Turquie, a été transformé en lieu de sépulture pour les victimes des maladies contagi"
814,"Dans un entretien accordé à l'AFP, la romancière américaine Paul Smith revient sur la pandémie de Covid-19 et sur son parcours."
815,Le magnat de l'immobilier américain Donald Trump est revenu au micro de RTL sur son expérience chez le magnat new yorkais.
816,"L'Académie nationale de médecine a appelé lundi les pouvoirs publics à ""prendre des mesures plus fortes"" pour lutter contre les problèmes de santé publique caus"
817,Les députés de gauche ont apporté leur plein soutien au personnel gréviste du groupe ferroviaire public.
818,"Le docteur Horacio Arruda, directeur national de la santé publique et sous-ministre adjoint à la Direction générale de la Santé au ministère de la Santé"
819,"Le ministre de l'Education Jean-Michel Blanquer a estimé mercredi 1er juillet que ""les raisons pédagogiques"" mais également ""psychologiques"" de"
820,Le président russe Vladimir Poutine doit passer ses visiteurs à travers un appareil qui les asperge de tous côtés de produits désinfectant.
821,"Selon les informations de La Voix du Nord, un différend entre voisins d'un immeuble collectif a dégénéré."
822,Le comédien britannique Roger Moore est décédé à l'âge de 90 ans.
823,"Le parquet de Paris a ouvert une enquête préliminaire pour des chefs d'""agressions sexuelles"" sur mineure de moins de 15 ans ""par personne"
824,"Le Palais de Kensington, la résidence officielle du prince William et de Kate Middleton à Londres, publie trois nouvelles photos de la fillette sur les réseaux sociaux."
825,"Pierre Jacquemain, conseiller stratégie de Pierre Jacquemain, publie ""Ils ont tué la gauche"" aux éditions Fayard, un ouvrage écrit par"
826,"L'Assemblée nationale a voté, sous les applaudissements, l'ouverture de la procréation médicalement assistée à toutes les femmes."
827,Une patiente de l'hôpital de Neuilly (Hauts-de-Seine) a subi un scanner en milieu d'après-midi.
828,Le Parisien révèle qu'un nouveau procès va s'ouvrir ce lundi 10 septembre à Bastia pour statuer sur cette affaire de famille vieille de 27 ans.
829,"La ministre de l'Intérieur Valérie Pécresse a annoncé jeudi qu'il s'agissait d'une "" prise de conscience"" des surveillants"
830,"Selon le Canard enchaîné, le chef de l'Etat n'a effectué, pendant ses deux semaines et demie de vacances, qu'une seule rencontre, avec"
831,"Un homme armé a ouvert le feu lundi 18 mars à Utrecht, aux Pays-Bas, tuant trois personnes et en blessant cinq autres avant de prendre la fuite."
832,Le coq Coco a été contraint à l'exil sur décision de justice car ses chants gênaient le voisinage.
833,L'amitié entre Emmanuel Macron et Johnny Hallyday ne date pas d'hier.
834,"L'un des animateurs préférés des Français s'est dit ""chagriné"" par cette affaire."
835,L'amendement du député La République en marche du Rhône Jean-Luc Fugit est examiné à l'Assemblée nationale.
836,Ils ont passé le réveillon du Nouvel An dans le vide à 50 mètres au-dessus de la terre ferme dans un manège bloqué pour une défaillance technique.
837,"Le Premier ministre Emmanuel Castex a rendu hommage jeudi à l'épouse d'Edgard Tupët-Thomé, un parachutiste de la Légende"
838,"La police a interpellé dimanche 2600 personnes à Nantes, dans la nuit du 21 au 22 juin 2019, après la disparition de Steve Wilson."
839,"Emmanuel Macron a appelé cette semaine à ne pas ""stigmatiser"" les musulmans, en dénonçant un ""raccourci fatal"" entre lutte contre le terrorisme et islam"
840,"Le journaliste Bruce Toussaint a lu mercredi soir sur BFMTV des passages d'un texte posté sur Facebook du ""gilet jaune"" Eric Drouet"
841,"Universal Music, Warner Music Group et Universal Music ont annoncé lundi qu'ils allaient participer au ""Black Out Tuesday"", une journée d'action consacrée à des changements significatif"
842,Les deux projets de loi sur la dette sociale et l'autonomie sont attendus au Sénat.
843,"L'enquête sur la mort de Robert Fuller, 24 ans, à Palmdale, est ""un grand sujet de préoccupation, non seulement à Palmdale mais dans tout le pays"
844,"L'ancien vice-président du Front national estime que la politique moderne consisterait à ce qu'on puisse travailler ensemble, ponctuellement, sur un sujet."
845,"Le nombre d'inscrits à Pôle emploi a progressé de 36% depuis janvier 2015, selon l'Unédic."
846,Des jets de pierres ont été découverts sur des voies ferrées en Gironde.
847,"Selon La Provence, le ministre de l'Economie, Samia Ghali, devait s'y rendre en compagnie de Samia Ghali, maire du huitième"
848,"L'ex-chargé de mission de l'Élysée Alexandre Benalla a annoncé qu'il s'agissait d'une société de conseil et de sécurité,"
849,"Le quotidien israélien Libération a annoncé mardi la nomination de son directeur général, Laurent Olivennes, à la tête de la rédaction."
850,"Selon les informations de RTL, le nombre d'appels concernant des maltraitances sur des personnes âgées a bondi de 13 % en 2018."
851,L'Agence régionale de santé (ARS) a annoncé mardi que 29 personnes âgées dépendantes avaient été testées positives au Covid-19.
852,Un dispositif spécial ville/hôpital de dépistage du coronavirus appelé NordCovid a été déployé au pied des tours des quartiers pauvres de Malpassé
853,"Sooraj, 27 ans, a été victime d'une attaque qui a coûté la vie à une vipère."
854,Le port du masque de protection face au Covid-19 devient obligatoire à compter de ce samedi dans les transports en commun au Danemark.
855,La montée des eaux boueuses a fait des dizaines de morts dans le Sichuan.
856,Les mutations du coronavirus ne semblent pas avoir de conséquences notables sur la façon dont se comporte le virus.
857,Un étudiant de l'université George Washington a signé une pétition demandant une forme de dédommagement de l'étudiant pour son master en santé publique.
858,"Un an après l'effondrement de trois immeubles dans la cité phocéenne, le ministre du Logement Julien Denormandie a promis une aide"
859,"Le Premier ministre, Jean Castex, s'est exprimé mercredi à l'issue d'une conférence de presse consacrée à la lutte contre l'islamisme radical."
860,Le président du groupe Les Républicains à l'Assemblée était fou de rage après l'élection des trois questeurs chargés de superviser les services financiers et administrat
861,"Le commissaire européen s'est dit ""peu emballé"" par l'idée de créer des ""centres fermés à l'extérieur de l'UE"""
862,"Le maire de Stains (Seine-Saint-Denis) a inauguré une fresque représentant les visages de George Floyd, mort lors de son interpellation aux Etats"
863,"L'Assemblée nationale a voté jeudi un texte visant à entériner l'ajout de 136 milliards d'euros de dettes au ""trou de la Sécu"
864,"Le président français Emmanuel Macron a rendu hommage à Downing Street, le ""dernier bastion de l'espoir"" au moment où tout semblait perdu."
865,"Un jeune homme s'est fait rouer de coups par deux hommes, dont le père de son ancienne copine."
866,L'hypothèse est que les malades du Covid-19 ont des variations génétiques qui ont des conséquences sur leur santé.
867,"Lucien Terragnolo, candidat du Rassemblement national aux municipales de Forbach (Moselle), est entouré d'un homme et d'une jeune femme..."
868,"Le magazine 60 Millions de consommateurs a passé au crible 130 produits alimentaires du quotidien dans son hors-série de juillet-août consacré au ""meilleur"
869,Ils contestent un projet de décret du gouvernement qui prévoit de transférer la compétence ministérielle d'autorisation de travaux sur ces sites aux préfectures.
870,Le pilote du F-15C Eagle du 48th Fighter Wing a été localisé et sa mort est confirmée.
871,"Le chef de l'État devrait une nouvelle fois réunir en Congrès à Versailles le Parlement, indique ce mercredi le journal Le Monde."
872,"Dans la banlieue de Montréal, une famille de déménageurs s'est confiée à une journaliste de l'AFP. ""Madame, le petit sofa, ça va"
873,"""Il y aura possiblement réouverture ce weekend, à la condition que l'on reçoive des dossiers avérés"", a déclaré le préfet des Alpes-Mari"
874,"Un homme a été retrouvé mort dans son appartement, à Nantes, dans le quartier Chantenay."
875,Le chef de l'État a comparé les retraites des agriculteurs à celles des cheminots.
876,"Dans le Calvados, la crue de la Dives reste ""soutenue à forte"", indique Vigicrues."
877,"L'album de Slimane, ""A Bout de rêves"", est sorti vendredi 8 juillet."
878,Marine Le Pen s'est exprimée lors d'un discours à l'Elysée. Le président du parti Les Républicains (LREM) n'a pas
879,Le président de la République s'est exprimé devant des entreprises du numérique.
880,"Un habitant d'un petit village d'Inde-et-Loire a demandé aux gendarmes de l'arrêter car il ""s'apprête à frapper"
881,"Pour ce premier week-end après la fin du confinement, certaines plages seront ouvertes au public mais sous certaines conditions."
882,Le suspect était accompagné d'un complice.
883,"Le ministre de l'Intérieur était invité à l'iftar, le repas de rupture du jeûne, organisé par le Conseil français du culte musulman (CF"
884,"Le 24 janvier dernier, Bruno Gaccio, ancien chef de file des Guignols de l'info et habitué des plateaux télé, a déposé deux plaintes pour menace"
885,"L'émission ""4 mariages pour une lune de miel"" sur TF1 a relancé la polémique autour de la supercherie du restaurant La détente gourmande"
886,Le président américain Donald Trump a annoncé mercredi qu'il retirerait 2200 soldats supplémentaires d'Irak d'ici la fin du mois.
887,"Le Front national s'est aussitôt emparé du sujet, Marine Le Pen parlant d'un ""acte de guerre""."
888,"Le ministre de l'Intérieur Christophe Castaner a demandé un rapport au préfet de police de Paris sur ""les modalités"" de l'évacuation contro"
889,"Dans un livre d'entretiens, Gérard Larcher, président du Sénat, et figure du rassemblement de la droite et du centre, se dévoile dans lequel"
890,"Le virus se cache dans des cellules ""réservoirs"", à partir duquel le virus pourrait à nouveau infecter d'autres cellules si le traitement est interrompu"
891,"Emily Schantz est partie en vadrouille en famille, samedi, lorsqu'une voiture devant elle a fait une embardée pour contourner un objet qu'"
892,"Bernard Chenebault a été démis de ses fonctions par Emma Lavigne, la présidente du fameux musée d'art moderne."
893,"La comédie musicale ""Notre-Dame de Paris"" a fait son grand retour au Palais des Congrès. Pour l'occasion, l'équipe de La Nouvelle"
894,L'essai britannique de dexaméthasone a permis de réduire la mortalité et la survie en cas de Covid-19.
895,Le comédien est introuvable depuis le 28 août dernier.
896,"Le chef de l'Etat, Emmanuel Giammattei, a assuré jeudi que son ""état de santé est stable"" et qu'il continuera à assurer ses fonctions en"
897,"Dans une lettre d'adieux, David Buckel dénonce la pollution de la planète pour justifier son geste."
898,"Dès la rentrée prochaine, les trois filières de la voie générale (S, ES et L) seront supprimées. Les mathématiques ne font pas partie des disciplines"
899,"Le 4 septembre dernier, après plusieurs jours de flou, Édouard Philippe avait annoncé que le prélèvement à la source de l'impôt sur le revenu serait bien mis"
900,"Le président turc a appelé la Grèce à se garder de commettre toute ""erreur"" qui mènerait à sa ""ruine""."
901,"Lors des célébrations du 75e anniversaire du débarquement de Provence, Emmanuel Macron a appelé les maires de France à les honorer."
902,"L'association SOS Homophobie a relayé une vidéo montrant l'agression d'une femme transgenre, commise au cours d'un rassemblement à"
903,L'humoriste s'est blessée lors des répétitions du Gala de l'Union des Artistes.
904,Trois liaisons sur dix seront assurées sur le réseau des TER.
905,La victime a dû être opérée en urgence pour extraire le projectile.
906,"La sortie de Gérard Collomb sur BFMTV, qui culpabilisait les manifestants et les incitait à s'opposer aux casseurs n'est"
907,"Le chef de file de La France insoumise Jean-Luc Mélenchon a appelé la France à ""aider"" l'armée syrienne qui doit envoyer des troupes dans"
908,Le couturier Karl Lagerfeld revient sur la mort de Johnny Hallyday.
909,Le jeune homme a succombé à ses blessures quelques heures plus tard à l'hôpital de la Pitié-Salpêtrière.
910,"Le maire PCF d'Échirolles (Isère), commune limitrophe de Grenoble, tire la sonnette d'alarme."
911,"L'ancien président de l'Assemblée nationale, François de Rugy, a insisté pour ne pas ""être vexatoire"" vis-à-vis de ses prédécess"
912,"Trois pièces maitresses de l'exposition ""Voyage dans les collections"" du musée Dobrée à Nantes ont été dérobées."
913,"Le niveau de pollution sur le pont de certains paquebots est parfois pire que dans les villes les plus polluées du monde, estiment les auteurs de l'"
914,"Invitée de Thomas Sotto ce lundi 21 novembre sur Europe 1, l'ancienne garde des Sceaux a affirmé son soutien à François Fillon."
915,"A l'occasion de la Journée mondiale de la gastronomie, les chefs étoilés s'interrogent sur les conséquences de la pandémie de coronavirus"
916,"La cinquantaine de militaires de la Marine nationale a obtenu la condamnation de l'Etat pour avoir été exposés, souvent pendant de nombreuses années, à des fibres d"
917,Le décret d'application a été signé mercredi 19 février.
918,"L'une des figures du mouvement a annoncé qu'elle ne participera plus aux manifestations des ""gilets jaunes""."
919,"Le vice-président de la région Hauts-de-France et président de la Communauté urbaine d'Arras, Philippe Rapeneau, est décédé"
920,"Dans un entretien au Parisien, le président de SNCF Voyageurs, Christophe Fanichet, a dévoilé la stratégie de l'entreprise pour assurer des transport"
921,"L'élection présidentielle de Porto Rico s'annonce cruciale pour la démocratie cubaine, où les électeurs d'origine cubaine sont majoritairement républicains."
922,"Une ""mini-tornade"" a frappé Villeneuve-Loubet, dans les Alpes-Maritimes, dans la nuit de mercredi à jeudi."
923,La scène a été commentée ce mardi par la présidente de la région Île-de-France Valérie Pécresse.
924,L'ancien ministre et président de l'OM s'est exprimé au concours d'éloquence des avocats du barreau de Paris lundi 7 septembre au soir
925,Le Premier ministre a répondu à une question sur les rumeurs de tensions avec Emmanuel Macron.
926,"La cour d'assises de Paris a requis la réclusion criminelle à perpétuité contre le Français Tyler Vilus, accusé d'avoir tu"
927,"La victime a été retrouvée morte, étranglée, à son domicile."
928,"L'anesthésiste-réanimateur de l'hôpital public parisien a tenu son journal de bord, chaque soir, pour l'AFP."
929,"L'Académie de Reims a annoncé mardi qu'elle ne descendrait ""que lorsque nos revendications auront été entendues"", a-t-on appris auprès"
930,"Kuêlan N'Guyen-Higelin, muse de Jacques Higelin, est décédée le 6 avril dernier."
931,Une enquête révèle que la plupart des conseillers de Marine Le Pen sont des anonymes.
932,"Le chef de l'État avait déclaré vouloir ""responsabiliser"" les personnes ""en difficulté"", ""il y en a qui font bien"" et d'autres ""qui déco"
933,"Le Conseil scientifique de l'Elysée a rendu jeudi son rapport sur le confinement, qui pourrait entraîner une ""nouvelle interruption"" du processus électoral"
934,Les bars devront fermer à partir de lundi 28 septembre.
935,"Lors de sa rencontre avec le vice-premier ministre d'Irlande du Nord Martin McGuinness, la reine a glissé une petite blague faisant all"
936,L'entrepôt réquisitionné pour les cercueils à Rungis représente-t-il un risque ? BFMTV répond à vos questions.
937,"Le Consistoire de Paris a appelé les synagogues à une ""réouverture progressive à partir du 4 juin"" et ""en faibles effectifs"", selon une lettre récente"
938,Un père de famille a pu être évacué de son domicile dans la nuit de jeudi à vendredi.
939,"L'homme de 48 ans a eu l'audace de passer une chanson de Beyoncé ""Crazy in Love"". Mariah Carey n'a pas apprécié"
940,Plusieurs centaines de sans-papiers ont pénétré dans le Panthéon pour réclamer leur régularisation et un rendez-vous avec le Premier ministre E
941,Un appel à témoins a été lancé par la police judiciaire pour retrouver l'homme disparu en Isère il y a sept ans.
942,La ministre de la Transition énergétique a souhaité mettre un terme à la polémique concernant ses vacances passées à Marrakech.
943,La région Auvergne-Rhône-Alpes a été l'une des zones les plus touchées par les fortes rafales de vents.
944,L'auteure du manuel d'histoire-géographie et éducation civique édité par Delagrave et sorti en 2010 une référence au site d'extrême
945,Une panne informatique a paralysé dimanche 1er septembre les communications des plans de vols des avions de ligne.
946,"Le photographe Christopher Allen a été tué par balle en août 2017 dans la ville de Kaya, au Soudan du Sud."
947,L'Observatoire national des stations de montagne s'est appuyé sur un échantillon de l'Observatoire national des stations de montagne.
948,L'accident a eu lieu vers 19h30.
949,"Le ministre des Finances a assuré que Paris et Washington avaient trouvé un ""cadre global commun"" sur la taxe numérique française."
950,"Priscilla Ludosky, figure du mouvement des ""gilets jaunes"", a lancé une pétition contre la hausse des taxes sur les carburants."
951,"Les sénateurs LR ont quitté l'hémicycle mercredi 3 juin pour protester contre une réponse jugée ""sotte et blessante"" de Sibeth Ndiaye"
952,L'humoriste Fabrice Eboué s'est retrouvé coincé alors qu'il venait de récupérer son fils chez sa mère en banlieue et rentrait chez
953,"L'avocat de Nordahl Lelandais, principal suspect dans l'affaire Maëlys, a dénoncé un ""acharnement évident"" contre son client."
954,Le nombre de décès supplémentaires au Royaume-Uni a atteint près de 60.000 mi-mai.
955,"Selon la station, au moins 250 appareils auraient été détruits, principalement brûlés, ces trois dernières semaines sur fond de contestation des ""gilets jaunes"
956,Plusieurs centaines de passagers de la ligne 14 du métro parisien ont dû être évacués après une panne électrique.
957,"Le président des Etats-Unis Donald Trump s'est exprimé vendredi sur la question de l'esclavage, au moment où les manifestations contre le racisme ont rela"
958,Le Premier ministre devance largement le chef de l'État qui ne recueille lui que 29% des suffrages.
959,"Dans un entretien accordé à France Télévisions, deux cousins de Nordahl Lelandais, poursuivi pour l'enlèvement et le meur"
960,Le parti du Premier ministre Mahindapaksa a remporté 145 sièges et ses alliés au moins cinq sièges.
961,"Le nombre de personnes contaminées par le Covid-19 a augmenté de 7,2 % en 24 heures en France."
962,"Dans une interview accordée au Monde, Cédric O se dit favorable à une instance d'évaluation des projets de reconnaissance faciale en France."
963,Le député Les Républicains du Vaucluse espère répondre à deux questions.
964,"Le Conseil scientifique alerte sur les risques d'un ""relâchement"" dans le respect des gestes barrières."
965,"Le drame s'est déroulé dans la rivière Doubs, dans le Val-d'Oise. Le père de deux enfants de 10 et 11 ans a été tué"
966,Le président des Républicains Laurent Wauquiez et la présidente du Front national Marine Le Pen se retrouvent sur la table après les attaques djihadistes de
967,"Les plaignantes, âgées de 23 à 28 ans, ""ont fourni à la police des témoignages assez longs"" et ""les auditions se sont terminées ce matin"
968,Le président de la République a rendu hommage aux militaires français déployés au Sahel.
969,"Dans l'émission ""C à Vous"", Laurent Ournac se confiait sur sa perte de poids."
970,"Le président brésilien, Jair Bolsonaro, s'est livré à des attaques inédites à l'encontre de la première dame française."
971,"Selon les informations du Télégramme, un vacancier normand de 56 ans a été découvert sans vie aux abords de la pointe de Beg ar Scaf."
972,"Le leader de la France insoumise a fait une entrée fracassante sur TikTok, le réseau social très prisé des jeunes."
973,Redoine Faïd s'était évadé en hélicoptère de la prison de Réau en juillet 201.
974,Le port du masque est devenu obligatoire dans les lieux publics clos pour enrayer une reprise de l'épidémie de coronavirus.
975,Les mesures annoncées par le président de la République devraient coûter entre 8 et 10 milliards d'euros.
976,"Dans un article du Canard enchaîné daté du mercredi 27 décembre, Emmanuel Macron aurait justifié sa démarche : ""il y a des millions de téléspectateurs qui ne"
977,"Le gendarme de l'audiovisuel a été saisi concernant une ""blague"" sur le viol que Jean-Marie Bigard a racontée dans ""Touch"
978,"Christophe Castaner a qualifié ""d'attentat"" le saccage de la permanence d'un député LREM en marge de la manifestation des ""gilets"
979,L'homme de 20 ans a été mis en examen pour homicide et blessures involontaires aggravés.
980,Le président de l'association 40 millions de consommateur estime que la mouture de janvier 2019 est abrogée parce que mauvaise.
981,"L'accusé a sorti un revolver et a menacé la victime, en lui plaçant le pistolet dans la bouche, avant de le frapper à l'ar"
982,La journaliste de France Info Myriam Bounafaa a commis une belle bourde ce week-end.
983,"Dans un article publié dimanche 25 août, les journalistes Gérard Davet et Fabrice Lhomme, auteurs d'""Un président ne devrait pas dire ça"", donnent"
984,Le chef de la chasse à courre Elsa Pilarski a été placé sous le statut de témoin assisté.
985,"Selon les informations de BFMTV, le taux de reproduction du Covid-19 en France est désormais de 2,62, soit un niveau similaire à celui qu'il y avait"
986,L'ancienne première dame a assuré au Parisien qu'elle avait fermé le placard de la politique.
987,L'embauche douteuse de Dominique Baert et Catherine Osson a été repérée par un candidat malheureux aux élections législatives.
988,"Les braconniers écument les abords du lac pour pêcher illégalement des carpes, avant de les exporter vers le Royaume-Uni"
989,"La disparition de Léa Lhuillier, disparue depuis mercredi à Grenoble, a été annoncée par la police nationale. Elle a été interpellée mercredi"
990,La gendarmerie d'Ille-sur-Têt (Pyrénées-Orientales) a été dépêchée sur les bords de la rivi
991,L'ancienne ministre de l'Economie et des Finances a pris la tête d'une coalition d'extrême droite qui s'est constitu
992,Le ministre des Affaires étrangères a exclu un retour des femmes française qui ont rejoint l'État islamique en Irak et en Syrie.
993,"Près de 86% des écoles de France devaient rouvrir leurs portes lundi pour leur pré-rentrée, et mardi à ""plus de 1,5 million d'enfants"" de"
