ID,titles
398,"La foire au jambon de Bayonne, qui se déroule chaque année dans la ville du même nom depuis 1462, est définitivement annulée pour l'année 2020."
399,L'alerte court jusqu'à jeudi matin.
400,"Les Etats-Unis enregistrent encore chaque jour presque un millier de décès ce qui, rapporté à la population, est le quadruple du taux de mortalité européen"
401,"Le président du groupe Leclerc, Michel-Édouard Leclerc, s'est exprimé dans une interview au Journal du dimanche."
402,"Selon les informations du Parisien, de plus en plus de jeunes se réunissent le soir pour réaliser un défi pour le moins risqué."
403,"L'homme d'une vingtaine d'années a été mis en examen pour ""homicide"" et ""acte terroriste"" après avoir ouvert le feu au"
404,"L'hôpital des urgences n°1 d'Omsk, en Allemagne, a confirmé jeudi le transfert de l'épidémie d'Alzheim"
405,"Dans les colonnes du Parisien, Michel Sardou est clair, à 70 ans, la musique, c'est terminé pour lui. Dans les colonnes du Parisien, il"
406,Un expert de 54 ans est décédé des suites du coronavirus.
407,"L'ancien président de la République François Mitterrand est décédé mercredi à l'âge de 90 ans, a annoncé le maire de Romain Poncelet."
408,"Selon Le Journal du dimanche, la majorité présidentielle à l'Assemblée rencontre des problèmes avec certains de ses membres."
409,"Selon les informations du journal Sud Ouest, les pickpockets font preuve d'une imagination débordante pour mettre en place leur technique de vol à la tire."
410,"L'Unsa, plus petit syndicat de la fonction publique hospitalière (5,6% des voix aux dernières élections), a signé un accord avec le gouvernement pour mettre fin au blocage"
411,"Le président de la République s'est exprimé dans une vidéo diffusée sur LeMonde.fr ce jeudi 11 mai, à l'occasion d'une conférence de presse"
412,Les députés ont approuvé jeudi 12 septembre en commission spéciale un amendement sur la filiation des enfants de couples de femmes nés par PMA (procré
413,"La pétition ""L'Affaire du siècle"" a recueilli un million de signatures en moins d'une heure, contre un million en décembre dernier."
414,"Le projet de loi du ministre de l'Éducation nationale ""sur l'école de la confiance"" et la réforme du lycée suscite la méfiance du monde enseignant"
415,La députée LREM de Haute-Garonne Sandrine Mörch a annoncé avoir été contaminée.
416,"Le ministère du Travail a confirmé avoir reçu une demande ""jeudi"" et l'avoir acceptée."
417,"Selon une enquête Ifop pour le Journal du dimanche, 72% des Français restent ""mécontents"" de l'action du chef de l'État, dont 37%"
418,"Le procureur de la République de Basse-Terre en Guadeloupe a ""émis le souhait d'être déchargé de ses fonctions"", révèle Le Monde"
419,"L'Institut de recherche pour l'agriculture, l'alimentation et l'environnement (Inra) a étudié les conditions de vie de ces parasites amateurs de sang"
420,"Le parc animalier rouvrira dans sa quasi totalité mercredi alors que les départements de l'Ile-de-France sont passés en ""orange""."
421,Le Comité d'organisation des Jeux de Rio de Janeiro a dévoilé jeudi 4 avril une étude présentée par le Comité d'organisation des JO.
422,"La tempête Ciara continue de balayer le nord de la France ce lundi, provoquant des dégâts sur son passage."
423,Le chef de l'État a choisi de réveillonner avec les soldats de la force Barkhane au Tchad.
424,"Le chef de l'Etat s'est exprimé lundi soir à la mairie d'Evry, au cours duquel il a présenté son projet prélèvemental."
425,"Un sondage réalisé par Odoxa pour BFM Business, Challenges et Aviva Assurances a montré que 75% des Français trouvent que la formule s'applique plutôt"
426,Un homme a été évacué à l'hôpital en urgence absolue.
427,"Un homme armé a été mis à l'arrêt dans un quartier d'affaires d'Europe à Paris, après un appel à la police."
428,"Le président américain, Donald Trump, s'est exprimé mercredi sur le volet financier de son combat contre le démocrate Joe Biden."
429,Le présentateur du JT de TF1 a expliqué avoir subi une intervention chirurgicale pour un cancer de la prostate.
430,"Le président de la République, Emmanuel Macron, est en tête du classement des cotes d'influence des sympathisants de droite et de centre-droit, selon"
431,"Les 1.600 magasins U (U Express, Super U, Hyper U) vont mettre en place, tous les mardis entre 13h30 et 15h30, deux ""heure"
432,"Cemil Sanli, ex-candidat de la France insoumise (LFI) dans la 4e circonscription du département de la Haute-Savoie"
433,"La commission Sauvé sur la pédocriminalité dans l'Église va être créée par l'Eglise catholique, a annoncé mardi le président de la"
434,"Le 7 mai dernier, un groupe de Français a été poursuivi par des guépards dans le parc animalier de Beekse Bergen, aux Pays-Bas."
435,"La ministre de l'Intérieur, Elisabeth Borne, a annoncé mercredi 9 septembre la fermeture de plusieurs crèches et collèges."
436,"La Fondation du patrimoine, qui a déjà collecté 13,1 millions d'euros des particuliers pour la reconstruction de Notre-Dame de Paris, a mis en garde mercredi contre"
437,"Une employée du supermarché Auchan City de Tourcoing, dans le Nord, raconte avoir fait une fausse couche sur son lieu de travail qu'elle n'"
438,L'ancien ministre de François Mitterrand s'est exprimé lors d'une conférence de presse à l'Elysée.
439,"Après une chute de confiance en début de semaine (67% lundi à 56% hier), les salariés du privé et les indépendants réaffirment leur croyance en la capacité"
440,Le ministre de l'Éducation nationale et la ministre de l'Enseignement supérieur ont présenté un décret portant modification des modalités de nomination des recteurs.
441,L'ancienne candidate à l'investiture des Etats-Unis Hillary Clinton a été particulièrement choquée par la façon dont le président américain a géré les 
442,"L'organisme semi-public FranceAgriMer, qui gère les marchés agricoles, a annoncé jeudi que les 33 distillateurs agréés en France pourront collect"
443,"La Chine a refusé de confirmer des pertes, mais des médias indiens ont fait état d'au moins 40 soldats chinois tués."
444,L'efficacité de cet anti-paludique est toujours en cours d'évaluation scientifique.
445,Les affrontements avaient eu lieu les 11 et 14 juin.
446,La circulation du coronavirus et les capacités de réanimation vont être revues à la baisse jeudi soir. Les départements en rouge ou vert pourront organiser un déconfinement plus
447,"L'état-major français a annoncé jeudi 9 janvier avoir mené plusieurs opérations de ""neutralisation"" dans le centre du Mali et dans le nord du Burkina Faso."
448,"La Belgique a interdit les voyages ""non essentiels"" de ses ressortissants vers le département. La préfecture a décidé de contre-attaquer."
449,L'avocat de la famille d'une Française ayant rejoint l'organisation Etat islamique en Syrie s'apprête à saisir la Cour de
450,"L'homme d'une vingtaine d'années a succombé à ses blessures dans la nuit de lundi à mardi, a annoncé la police japonaise"
451,Le ministère de la Justice n'a pas confirmé de lien entre ce décès et le Covid-19.
452,"Le présentateur de ""Mille et une vies"" sur France 2 est l'invité de l'émission Mille et une vies sur France 2, diffusée sur Canal+"
453,"Le jury et Marianne James, toujours très à l'aise dans l'exercice de maîtresse de cérémonie, se sont qualifiés pour la seconde et ultime phase du concoc"
454,La chancelière allemande Angela Merkel a reçu jeudi la chancelière allemande Angela Merkel à la chancellerie.
455,L'association de défense des consommateurs CLCV a analysé 1.000 annonces immobilières publiées entre juillet et novembre 2019.
456,Les soutiens d'Alain Juppé n'ont pas apprécié le soutien apporté par Nicolas Sarkozy au soir du premier tour.
457,L'ancien président de la République s'est exprimé dans les colonnes du quotidien italien Corriere della Sera.
458,Un homme de 30 ans qui circulait sans casque sur une moto de cross a eu la jambe gauche fracturée après avoir heurté la portière ouverte d'une
459,L'avocat du pédophile d'Ixelles a demandé au parquet de Bruxel de remettre en liberté conditionnelle son client.
460,L'affaire Adama Traoré a relancé le débat sur les violences policières couplées à celles de racisme.
461,Un proche de Chérif Chekatt va être présenté ce lundi 17 décembre à un juge d'instruction antiterroriste à Paris en vue de sa mise en examen.
462,L'association européenne Transport et environnement dresse un bilan des conséquences de la pollution aux particules fines sur le corps humain.
463,"L'ancien président du Conseil constitutionnel, Jean Louis Debré, s'est confié au Journal du dimanche sur son ami Jacques Chirac. L'ancien président du Conseil constitution"
464,L'ancien conseiller spécial du président Nicolas Sarkozy a été insulté par plusieurs électeurs de la 2e circonscription de Paris.
465,"La Commission européenne a envoyé une lettre de mise en demeure à la Tchéquie, à Chypre, à la Grèce, l'Italie, la Croatie"
466,L'appareil a été testé pendant un mois sur une route très empruntée des motards à Saint-Forget dans les Yvelines.
467,"La vice-présidente du parti Les Républicains, Virginie Calmels, écarte tout rapprochement avec le président de Debout la France, Nicolas Du"
468,Jean-Luc Mélenchon et cinq de ses proches se présentaient devant la justice jeudi 19 septembre pour faire la lumière sur les altercations qui ont eu lieu avec les forces
469,"Le monde de la nuit se désole d'être ""la dernière roue du carrosse"": le cas particulier du clubbing n'est pas abordé par le plan"
470,"Le président de la République a estimé samedi 21 décembre en Côte d'Ivoire que le colonialisme a été ""une faute de la République""."
471,"Après l'identification ""de cas d'infection à salmonelle de personnes ayant consommé du reblochon au lait cru produit par l'entreprise"", la société a décidé"
472,"Une vingtaine de prêtres et de théologiens ultraconservateurs ont appelé les évêques à qualifier d'hérétique le pape François, rapporte"
473,L'Élysée a mis en vente une cinquantaine de produits dérivés dans l'objectif de financer la rénovation de ses bâtiments.
474,"La moitié des clubs discothèques du pays vont disparaître si une réouverture n'est décrétée qu'en septembre et ""30 à 40%, maintenant"", a pré"
475,"L'Ile-de-France, l'Eure et la Seine-Maritime sont désormais en vigilance rouge canicule, en raison du ""risque de sur"
476,"Le passage de Benjamin à Disneyland Paris a tourné au conflit. Le 21 avril dernier, l'homme atteint de trisomie 21 s'est rendu au parc d'at"
477,"Selon les informations du quotidien Ouest-France, une petite fille a ingurgité par erreur un liquide qui s'est trouvé être du détergent destiné à la vais"
478,Trois personnes sont décédées en raison des intempéries dans le sud du pays.
479,"Le milliardaire républicain a promis ""les plus grandes festivités du 4 juillet de l'histoire"" de la capitaine des États-Unis."
480,"Au total, 39 personnes ont été interpellées."
481,"Les rappeurs Booba et Kaaris, détenus à Fleury-Mérogis (Essonne) et à Fresnes (Val-de-Marne"
482,Les corps de 18 dauphins d'Electre ont été retrouvés et autopsiés.
483,"En 2016, le nombre de personnes diagnostiquées pour une infection à chlamydia a été estimé à 267.097 (491 pour 100.000 habitants de 15 ans et plus), selon"
484,La station spatiale chinoise Tiangong doit s'écraser sur Terre dans les prochaines semaines.
485,L'ex-procureur national financier (PNF) Eliane Houlette s'est exprimé dans un entretien accordé au Journal du dimanche (JDD)
486,"Le Parlement européen vient de réévaluer à la hausse le préjudice que l'ex-candidate à la présidentielle aurait fait subir au FN, révèle l'hebdomada"
487,"L'ancien président de la République doit se déclarer au plus tard jeudi prochain, soit quinze jours avant le dépôt des candidatures."
488,L'Espagne n'a enregistré que 164 morts du Covid-19 au cours des dernières 24 heures.
489,"Un couple de retraités a été placé en garde à vue dans le cadre de l'enquête sur le vol présumé de bijoux de sa maison de retraite à Paris, a annoncé"
490,"Un groupe d'insecticides a ravagé près de 50.000 hectares de cultures d'insecticide dans l'État du Rajasthan, en Inde, a"
491,"Un père et une mère de deux enfants ont été blessés par des tentatives de calmer et de maitriser le père de leur fils dans la nuit de samedi à dimanche,"
492,"L'exécutif a exigé de ""l'efficacité sur tous les sujets"", a indiqué une source proche de l'exécutif."
493,"Le Falcon 7X du président français a percuté l'Airbus de son homologue sénégalais, rapporte Paris Match."
494,"La commission d'enquête sénatoriale sur l'affaire Benalla juge ""pour le moins fragile"" la thèse ""officielle"" selon laquelle Alexandre Benalla n'"
495,La Turquie vient de vivre une nuit de violences entre les putschistes et les forces loyalistes. Le coup d'État s'est déroulé ce vendredi dans la nuit
496,"Il n'y a plus de risque de nappes d'hydrocarbures en Charente-Maritime après le naufrage du ""Grand America""."
497,"""Il y a un check-up. Le président de la République a demandé de vérifier que tout va bien fonctionner et que tout est bien compris par les Français"", a-t"
498,Le Canard enchaîné révèle que pas moins de 126 responsables de Force ouvrière (FO) ont été fichés dans un document interne affublés de ces qualifica
499,"La cinquième femme inhumée au Panthéon, après Sophie Berthelot, la physicienne Marie Curie et les résistantes Germaine Tillion"
500,"Le rapport explore ""la situation des concessions dont la rentabilité est généralement perçue comme trop favorable""."
501,Le groupe d'artistes afro-américains s'est inspiré d'un visage d'un Afro-Américain âgé pour créer la marque Uncle Ben's
502,"Le nouveau coronavirus n'a pas toujours été transmissible, mais il semble que le virus se réplique mieux et puisse être plus transmissible."
503,Un homme aurait loupé un virage dans une zone réservée aux piétons avant d'enfourcher un plot métallique.
504,Les musées britanniques de l'histoire et de la culture s'envolent pour attirer les touristes étrangers. La capitale anglaise est devenue un
505,"Selon les informations du Progrès, les soutiens de David Kimelfeld et Gérard Collomb n'hésitent plus à s'interpeller verbalement devant"
506,"L'un des badauds avec lequel a discuté le chef de l'État n'était autre que Maxime Boissière, ""fraîchement nommé"
507,L'exécutif a dû faire appel au sens de la responsabilité des Français pour respecter certaines dispositions.
508,"Après avoir assuré qu'il n'irait pas manifester à Paris aux cotés de Jérôme Rodrigues, l'humoriste s'est finalement rendu place de"
509,L'Allemagne a prolongé jusqu'en novembre l'interdiction des grands rassemblements pour éviter la résurgence du coronavirus.
510,"L'élu de Paris assure qu'il n'a en ""aucun cas"" été poussé à partir."
511,Le chanteur Charles Aznavour s'est éteint dans la nuit de dimanche à lundi.
512,"L'épouse d'Emmanuel Macron n'a pas rejeté ""cette responsabilité qui vous tombe dessus de représenter les Françaises et les Français"", a-"
513,"Dianne Feinstein, sénatrice démocrate de Californie, s'est dit ""en train d'enquêter"" sur les méthodes du président américain,"
514,"Selon les informations de France Dimanche révélées ce 2 juin, le chanteur a perdu son ex-femme, Monique, décédée le 18 mai dernier."
515,Le Parti socialiste n'est pas parvenu à s'imposer dans les sondages pour la présidentielle. Le parti n'est pourtant pas parvenu à obtenir la majorité absol
516,L'alerte entrera en vigueur à 18 heures.
517,Une étude publiée jeudi pointe un risque accru de décès du Covid-19 chez les patients hypertendus qui ont cessé de prendre leur traitement après admission à
518,"Près d'un Italien sur trois estime que ""le pire est derrière nous"", un score plus élevé qu'en France."
519,L'ancienne ministre de la Transition écologique s'est exprimée dans une interview accordée au Figaro.
520,L'artiste français Jean-Marie Bigard a réussi à pardonner à son père qui a tué son père.
521,"L'émission ""Balance ton salaire"", sur LCP, a pour thème ""L'impossibilité d'un emploi digne d'aujourd'hui"" et"
522,Les villes de Lyon et de Nice vont imposer de nouvelles mesures locales d'ici samedi.
523,"Le niveau 3 du plan canicule a été activé en région parisienne, mardi matin."
524,"Le 20 février 2018, la jeune femme avait été frappée à coups de pieds et de poings dans une rue d'un quartier populaire du nord de Marseille."
525,"L'animateur de ""Chasseurs d'appart"", Stéphane Plaza, a annoncé mercredi qu'il se confiait à VSD sur l'état de santé"
526,Le niveau des stocks de carburant ne donne pas lieu à l'inquiétude.
527,Une odeur de gaz suspecte décelée au niveau des travaux en cours devant la gare et de l'accès au métro a conduit à l'immobilisation des train et
528,"Selon Le Parisien, une enquête préliminaire a été ouverte pour les chefs de ""corruption de membres de l'Union euro"""
529,"Dans le magazine Challenges, un proche de l'ex-chef d'Etat confie que les sarkozystes ont un regret : celui d'avoir laissé François Fillon"
530,"Les esprits, déjà bien échauffés par les 40 degrés ressentis vendredi 31 juillet, n'ont pas mis longtemps à s'enflammer."
531,"L'ancien leader catholique nationaliste, décédé dimanche à l'âge de 90 ans, est décédé des suites d'une courte maladie, a annoncé sa"
532,"Un automobiliste a percuté au niveau d'un passage piéton, à l'intersection de deux rues d'un quartier populaire de Saint-Étienne"
533,"Selon les informations de BFMTV, plusieurs aspects vont être scrutés pour permettre une sortie future de cette crise sanitaire liée à l'épidémie de coronavirus."
534,"Babe a été abattue et dépecée pour terminer dans l'assiette de sa propriétaire, révèle Ouest-France."
535,Jean-Yves Le Drian a été interrogé sur le maintien d'Edouard Philippe à Matignon jusqu'à la fin du mandat d'Emmanuel Macron
536,"La veuve du comédien Mouss a fait des confessions émouvantes sur sa vie, sur son fils et sur la succession qu'elle a dû gérer."
537,Le candidat des Communistes de Russie Maxim Souraïkine a tenté de s'en prendre au représentant du Parti communiste.
538,"Billy Jean, une infirmière new-yorkaise, a rendu hommage jeudi à des milliers de personnes confinées dans son hôpital, à New York, après avoir été"
539,"Pour Rachida Dati, l'ancien président de la République ne reviendra pas."
540,Le photographe Pascal Hess s'était résolu à ne pas voyager à bord du MS804 d'EgyptAir car il ne trouvait pas ce document
541,"Le parquet de Paris a requis des peines allant de 18 mois ferme à sept ans de prison contre un industriel, trois politiques et deux intermédiaires pour abus de"
542,"Un administrateur du portail Médecine intégrée se présente comme médecin généraliste, homéopathe et acupuncteur."
543,"Le scientifique américain Francis Collins s'est dit "" absolument d'accord"" avec la création d'un vaccin au Brésil."
544,Le parquet de Paris a ouvert deux informations judiciaires contre l'artiste russe Piotr Pavlenski.
545,L'ancien premier ministre Alain Juppé s'est exprimé dans un entretien accordé au Journal du dimanche (JJDD) à l'issue d'
546,Une vingtaine de femmes victimes de violences conjugales ont pris leurs quartiers dans les installations du club phénicien.
547,"Carlos Ghosn devrait sortir de prison mercredi, une fois l'argent versé."
548,Le juge d'instruction s'est rendu sur les lieux pour procéder à diverses vérifications.
549,"La présidente de France Télévisions, Delphine Ernotte, s'est dite fière de l'annonce de la participation de la France à l'Euro"
550,"Une quarantaine de personnes en provenance de France se rendant au Royaume-Uni seront soumises à partir de samedi à une quarantaine de deux semaines, a"
551,"Les autorités iraniennes ont confirmé la propagation de l'épidémie de Covid-19 en Iran, selon des chiffres publiés lundi par le cabinet d'"
552,L'ancien ministre des Affaires étrangères Boris Johnson a été désigné dans un fauteuil par les militants du Parti conservateur britannique pour succéder à la Premi
553,Un violent incendie s'est déclaré dans un entrepôt de textile. Les pompiers sont en train d'intervenir.
554,"L'alerte, qui concernait déjà l'Aude, l'Hérault, les Pyrénées-Orientales et le Tarn, est désormais en vigueur pour"
555,"Laurence Boccolini a fait part de sa détresse et de son ""bad day malgré le soleil""."
556,"Le président américain Donald Trump s'est dit ""écoeuré et horrifié"" après la mort d'un manifestant à Londres après l'interdiction des rassemblements en"
557,"Selon les chiffres officiels, 10.581 nouveaux cas ont été enregistrés dans les dernières 24 heures, soit 52 de moins que le record de dimanche."
558,Le chef de l'État voit sa cote de popularité s'effondrer un peu plus à chaque sondage.
559,"Le ministre de l'Intérieur a fait savoir qu'une opération de police était ""en cours"" dans le quartier du Mistral à Grenoble."
560,"Le chroniqueur de Touche pas à mon poste a publié une photo de lui, alité dans une chambre d'hôpital."
561,"Le Liban est en proie à un mouvement de protestation inédit contre la propagation du nouveau coronavirus, a annoncé samedi la Croix-Rouge."
562,Le jeune homme accusé d'agression sexuelle par une candidate a été remis en liberté ce lundi soir.
563,"En 2017, 109 femmes ont été tuées par leur conjoint, selon les chiffres publiés par l'Observatoire national de la délinquance et des réponse"
564,"Ali Khamenei, le président de la République égyptienne, s'est exprimé vendredi à l'occasion de la ""Journée d'Al-Qo"
565,"La commission d'enquête sur le coronavirus de l'Assemblée nationale se penche mercredi sur la question de l'hydroxychloroquine, avec l'audition"
566,L'homme d'affaires aurait confié avoir donné le même conseil au plus jeune de ses petits-fils.
567,Un groupe de personnes cagoulées ou masquées a fait irruption dans les allées du magasin Intersport à Étampes (Essonne) dans la nuit
568,"Un journaliste proche de Richard Ferrand a porté plainte contre le président de l'Assemblée nationale pour ""discrimination""."
569,L'ancien Premier ministre s'est exprimé sur le plateau de France 2 le 30 janvier.
570,"Selon les premiers éléments de l'enquête, il s'agirait d'un homme de 28 ans qui aurait été tué d'une balle dans la tête."
571,Des riverains d'un quartier résidentiel ont empêché la distribution de repas aux migrants par les associations.
572,"Carole Ghosn était mardi au micro de RTL pour évoquer la situation de son mari, l'ex-PDG de Renault-Nissan Carlos Ghosn"
573,"Quatre hauts responsables du lobby des droits de l'homme ont été arrêtés par la justice américaine, accusés d'avoir ""en gros pillé les bien"
574,"Le corps d'un randonneur, vraisemblablement tué par la chute d'une grosse branche d'arbre, a été découvert dans la matinée de dimanche"
575,Le cofondateur du Front national émet quelques réserves sur le choix de la tête de liste du parti Jordan Bardella.
576,"Le corps de cette femme de 55 ans, disparue depuis près de deux mois, gisait dans la chambre de son appartement."
577,La mégalopole d'Asie du Sud-Est a mis en place une liste de sanctions visant à prévenir les infections au coronavirus.
578,Le nombre de décès dans le monde depuis l'apparition des premiers cas en Chine en décembre s'élève à 900.052 décès.
579,Un important incendie s'est déclaré dans la nuit du dimanche 10 au lundi 11 mars à l'usine Michelin de Roanne.
580,"Le mystère de l'influence des germes sur l'homme n'a jamais été aussi profond qu'au XVIe siècle, selon l'historien William"
581,"L'intrusion ""grave et inadmissible"" des forces de sécurité israéliennes a provoqué l'intrusion ""grave et inadmissible"
582,"L'ex-collaborateur d'Emmanuel Macron a expliqué avoir ""fait une demande à titre personnel"", ""pour des motifs de défense et de sécurité personnels"
583,"David Belliard, le candidat du parti Les Républicains à l'élection présidentielle, s'est confié au Journal du Dimanche sur France 2 ce mercredi."
584,Un jeune de 16 ans a trouvé la mort dans un accident de la route causé par un policier hors service et alcoolisé.
585,Le ministre de la Santé a rappelé les risques liés à l'épidémie de coronavirus encore bien présents en France.
586,Les rumeurs de censure ont commencé à se répandre parmi les internautes.
587,"Le ministre de l'Economie et des Finances, François Castex, a estimé mardi que le port du masque pouvait parfois être ""pénible""."
588,Le Rassemblement national et La France insoumise dénoncent les dégradations commises un peu partout dans l'hexagone contre les locaux de parlementaires L
589,"Depuis le bac 2014, les élèves de terminale ont pris l'habitude de lancer une pétition pour dénoncer la difficulté supposée de certaines épreuves. Cette"
590,"Après la Haute-Marne et la Seine-Marne, les deux départements voisins ont annoncé le retour de la vitesse maximale à 90km/h sur près de 700"
591,"Lors de la présentation du plan santé, Emmanuel Macron a confié qu'il aurait aimé aller plus loin."
592,"Le point de départ de cette histoire vient du livre ""Mélenchon : aux portes du pouvoir"" publié chez First le 8 novembre dernier."
593,"La procédure de destitution pour ""incapacité morale"" a été lancée par le Parlement."
