ID,titles
994,"La présidente de la commission des Affaires sociales à l'Assemblée nationale Brigitte Bourguignon s'est émue des ""constantes réflexions"" du député communiste"
995,"La mère de l'enfant est infirmière libérale et vivait seule à Reichstett, au nord de Strasbourg."
996,L'analyse des prélèvements réalisés depuis l'incendie indique qu'il n'y a pas de risques liés à l'absorption de plomb lors
997,"Un bilan provisoire fait état de 75 morts dans le district de Tarn Taran, dans l'Etat du Pendjab."
998,Le maire Les Républicains de Meaux a confirmé ce vendredi matin au micro de RTL avoir rencontré la veille le président du parti.
999,L'association de consommateurs CLCV a assuré jeudi soir que l'exécutif avait un plan qui expliquerait la hausse des taxes sur les carburants.
1000,"Un cortège de militants radicaux ""black bloc"" s'est constitué au sein de la marche pour le climat à Paris."
1001,Les faits se sont déroulés peu avant trois heures du matin dans le quartier huppé des Champs-Elysées.
1002,"La maison-mère de Free, Altice, s'acquittera d'une prime de 1.000 euros, destinée à un nombre encore indéfini de salariés."
1003,L'ex-candidat de la France insoumise est allé jusqu'à se réjouir de la mort d'Arnaud Beltrame.
1004,Le procureur de la République de Soissons a précisé que des services de la gendarmerie nationale étaient allés sur les lieux.
1005,La secrétaire d'État à l'Économie Agnès Pannier-Runacher a prévenu que les entreprises ayant recours au chômage partiel se
1006,Le leader de la France insoumise Jean-Luc Mélenchon réagissait à un décret paru au Journal officiel en août et qui a fait l'objet d'un
1007,Le frère de Nordahl Lelandais a accepté de se confier au micro de RTL.
1008,Un hangar est en proie aux flammes depuis 12h15.
1009,Le secrétaire d'Etat chargé de la Fonction publique a douché les espoirs des fonctionnaires qui espéraient être concernés par le versement d
1010,L'Académie des sciences et l'hôpital de la Pitié Salpêtrière ont révélé les résultats d'une étude sur 480 malades
1011,"L'ancienne reine des Etats-Unis, âgée de 44 ans, a été placée en détention provisoire par la famille royale."
1012,L'homme a péri en tombant dans une crevasse alors qu'il faisait l'ascension du mont Quitaraju.
1013,"Le parti d'extrême droite (RN) a obtenu un ""rééchelonnement"" pour le non-remboursement d'un prêt d'environ neuf"
1014,"Selon le site d'information régionale Le Télégramme, cinq agents de sécurité ont dû intervenir pour maîtriser l'assaillante."
1015,"Un ingénieur américain s'est écrasé samedi 22 février près d'une autoroute, rapporte LCI."
1016,"La chancelière allemande a été victime d'un malaise de plusieurs minutes pendant qu'elle attendait, debout et dans la chaleur de la m-journée"
1017,"La fréquence des naissances de malformations en Rhône-Alpes a été mise en place par le Remera, qui recense et surveille les naissances."
1018,"L'Australie a été frappé lundi par une cyberattaque qui pourrait avoir des répercussions sur l'économie et l'économie australiennes, a annoncé"
1019,"L'ancien présentateur du jeu de France 3, Julien Lepers, a annoncé qu'il présenterait chaque jour ""La grosse émission"" sur la chaîne payante Com"
1020,"L'accident s'est produit dans un parc d'attractions de la ville de Croix-Rouge (Seine-Saint-Denis), dans la nuit de"
1021,"Selon les dernières informations de 20 Minutes, trois personnes ont perdu la vie dimanche 9 août."
1022,La ministre de la Littéraire a rendu hommage à l'écrivaine afro-américaine.
1023,Deux suspects ont été placés sous contrôle judiciaire dans l'attente de leur procès.
1024,"Le comité confédéral national de la fédération des transports (CCN) s'est réuni jeudi à Paris pour élire son président, Patrice Clos,"
1025,L'Assemblée nationale a approuvé mercredi en première lecture l'expérimentation prévue par le gouvernement de collecte de données sur les réseaux sociaux pour détecter des fraude
1026,"Pour la pochette de son nouvel album, Zazie a choisi de s'afficher au naturel et topless."
1027,Le secrétaire d'État chargé du Numérique a envoyé un message au journaliste Vincent Glad sur Twitter.
1028,Cyril Hanouna est sur tous les fronts. L'animateur de Touche pas à mon poste est sur tous les fronts.
1029,La porte-parole de la France Insoumise annonce dans le Journal du Dimanche qu'elle arrête la politique.
1030,"Les livrets d'épargne réglementée, dont le Livret A fait partie, sont de plus en plus concentrés en France."
1031,"L'incendie serait parti d'une ""explosion suivie de feu à cause d'un incendie""."
1032,Le journaliste de France 2 a confié avoir essayé de vendre du shit à un jeune Marocain à l'âge de 17 ans.
1033,Le parquet doit à présent prendre ses réquisitions avant que les juges ne rendent leur ordonnance finale.
1034,"Le documentaire ""Un jour, un destin"" revient sur les dures méthodes d'éducation appliquées par le monstre sacré du cinéma avec son fils aîné, Anthony"
1035,"Repéré de nombreuses fois par les habitants, l'animal est pourtant resté en liberté durant tout ce temps."
1036,Une photo publiée par Le Point montre deux membres de la garde rapprochée du candidat à la présidentielle de 2017 dans un café.
1037,L'homme d'affaires Jean-François Copé a été sanctionné par un tribunal correctionnel de Grenoble (Seine-Saint-Denis
1038,"Après deux années de hausses successives, en 2016, et 2017, les prix du Pass Navigo à tarif unique (75,20 € mensuels) et du forfait"
1039,"Météo-France a élargi la vigilance météorologique à la Charente-Maritime, avec pour résultat autant de départements au même moment sur la carte de vigila"
1040,Près de 5.000 personnes étaient venues à l'Elysée pour rendre hommage à l'ancien président.
1041,"L'ancien président ivoirien Alassane Ouattara, Alassane Bédié, a rendu hommage jeudi à l'opposant Alassane Ouat"
1042,Un groupe de trois voyageurs a décidé de relever les températures à bord du RER B.
1043,Des vents violents ont balayé le littoral atlantique et l'intérieur des terres ces derniers jours.
1044,"Selon les premiers éléments, deux employés ont été grièvement brûlés après avoir ""reçu une projection de produits chimiques"" vers 9h."
1045,"Le Muséum national des arts de la table (LPO), qui gère la réserve ornithologique de macareux, a effectué son dernier recensement en 2016."
1046,"Les parents d'Alexia Daval, Isabelle et Jean-Pierre Fouillot ainsi que son beau-frère Grégory Gay ont assisté à une reconstitu"
1047,Le rongeur se trouvait dans l'assiette d'épinards distribuée sur le plateau repas du patient.
1048,"Selon les informations du Parisien, un seul cas de décès a été constaté dans l'Oise, et non dans le département."
1049,"En mai, 7,8 millions de salariés étaient encore au chômage partiel, entraînant par conséquences des pertes de revenu."
1050,"L'islamologue incarcéré et mis en examen depuis le 2 février pour ""viols"" aurait tenté de se procurer un téléphone portable en prison, rapporte le Journal"
1051,La Nouvelle-Calédonie a été déclarée jeudi 27 décembre en situation d'épidémie de dengue.
1052,Le ministre de l'Écologie était l'invité de France Inter ce mercredi 16 octobre.
1053,"L'ancien chanteur de Johnny Hallyday, Renaud Renaud, n'a pas dit oui à une chanson de Johnny Hallyday, qui l'avait"
1054,Le duo Les Chevaliers du Fiel est de retour sur le petit écran. Après des années de succès à la télévision grâce aux nombreuses rediffusions de leurs anciennes
1055,L'homme d'affaires Chouviat Chouviat a été arrêté le 16 avril dernier par un policier de la gendarmerie du Val-d'O
1056,L'avocate auprès du Barreau de Paris Maud Sobel a été chargée de représenter certains des anciens assistants parlementaires de l'élue.
1057,"L'hôpital américain de Neuilly-sur-Seine, qui a accueilli plus de 500 patients atteints du Covid-19, subit les conséquences économiques de"
1058,"Le président de la région Lombardie, Attilio Fontana, a annoncé dimanche 23 février qu'il comptait déjà ""plus de 100 cas"" de Covid-19 en Italie"
1059,"En avril dernier, un chauffeur routier polonais a volé 3.000 euros à un chauffeur routier. Le chauffeur porte plainte."
1060,La police anglaise a arrêté un homme soupçonné de meurtre et de sept tentatives de meurtre pour une série d'attaques au couteau à
1061,"Les députés vont examiner lundi 17 février un projet de loi visant à créer un ""système universel"" de retraite par points."
1062,La chronique matinale de Julien Mielcarek a été l'objet de nombreux détournements.
1063,"Repéré dans un état second dans la rue par la police municipale, cet homme de 53 ans s'était réfugié chez lui, sans que personne ne parvienne"
1064,Le procureur de la République de Boulogne-Billancourt (Hauts-de-Seine) a condamné la Poste à 120.000 euros de dommages et intérêt
1065,"Selon Le Figaro, plus de 3 000 mineurs inscrits au parti Les Républicains (LR) pour voter pour le premier tour de l'élection présidentielle 2017 Le Fig"
1066,"L'animateur radio et comédien fait l'objet de plusieurs plaintes, dont une pour menaces de mort, déposée par l'ex-auteur des ""Gu"
1067,"L'acte 18 des ""gilets jaunes"", organisé samedi 16 mars, a connu un fort regain de violences."
1068,La maire de Paris Anne Hidalgo s'est exprimée dans un tweet sur la distribution des masques.
1069,"Selon le Canard enchaîné, Annick Girardin aurait remporté des appels d'offres à Saint-Pierre et Miquelon, fief de la"
1070,"Les Jordaniens sont majoritairement opposés au plan de sauvetage de l'Etat de Jordanie, selon un sondage publié jeudi par le site Ipsos"
1071,"Le président de la commission des lois du Sénat, Jean-François Delfraissy, a estimé que 18 millions de personnes à risque devaient rester confi"
1072,"Les Foyers de la charité, qui organisent des retraites spirituelles partout dans le monde, ont lancé en septembre une commission de recherche indépendante."
1073,"Selon BFMTV, Jonathann Daval, 29 ans, a été mis en examen et placé en détention provisoire à l'issue d'une enquête sur le me"
1074,Les restrictions de déplacement ont été levées sur tout le territoire depuis mardi.
1075,"Le premier secrétaire du PS a organisé un meeting intitulé ""Loi Travail : face aux régressions de la droite sénatoriale, défendons le progrès"
1076,Des chasseuses de l'association Dianes Chasseresses ont porté plainte pour menaces de mort.
1077,"Le sanctuaire de Shah-Abdol-Azim, à Téhéran, a commencé à recevoir des fidèles tôt le matin."
1078,Un avion de ligne de China Eastern a dû atterrir en urgence à Sydney le 11 juin en raison d'un problème technique.
1079,"Deux pêcheurs ont perdu la vie à l'entrée de la lagune dans une collision avec un autre bateau, rapporte 20 Minutes."
1080,"Mohamed Abdeslam avait déclaré à la presse que son frère ""avait volontairement refusé de se faire sauter""."
1081,L'événement s'inscrit dans le cadre des 30 ans de l'installation du ministère à Bercy.
1082,Le fournisseur d'électricité a été sanctionné par la répression des fraudes.
1083,Le premier cas de contagion locale dans le quartier de Mme Wong a été détecté dans la capitale hongroise.
1084,"Selon Le Parisien, le haut-commissaire à la Haute Autorité pour la transparence de la vie publique n'aurait pas fait état d'une fonction d"
1085,"Le balcon d'un immeuble HLM a fait trois blessés dont deux graves, samedi 12 mai, à Yvetot en Seine-Maritime."
1086,"Plusieurs personnes sont venues perturber les célébrations sur les Champs-Elysées, dans la soirée de mardi 18 août."
1087,"Le ministère de l'Intérieur a décidé de retirer de son arsenal les grenades lacrymogènes GLI F4, au profit d'une arme à"
1088,"Ce dimanche, à la RATP, le trafic sera ""extrêmement réduit"". Les lignes de métro automatiques 1 et 14 fonctionneront normalement."
1089,"L'Institut français de recherche pour l'exploitation de la mer (Ifremer) met notamment en garde contre Dinophysis, une micro-algue, invisible à"
1090,"Le chef de l'Etat a visité les locaux du pôle de formation aéronautique du lycée Roger-Claustres, puis un centre de promotion des métiers"
1091,La commission d'enquête sénatoriale sur la gestion de l'épidémie de Covid-19 a rendu son rapport mardi 22 septembre. La ministre des Armées Florence Par
1092,Le chanteur Bruno Beau­sir s'est confié sur sa rencontre avec Christine Angot.
1093,"Sur le plateau de ""Punchline"" ce dimanche 12 mars, la présidente du Front national a soigné son effet d'annonce."
1094,Vincent Lambert est en état végétatif depuis un accident de la route survenu en 2008.
1095,"La justice lui reproche d'avoir visé avec un laser un hélicoptère de la gendarmerie lors de l'acte 10 des ""gilets jaunes"""
1096,"L'ancienne ministre de l'Education et des Finances, Chantal Jouanno, a décidé de se lancer dans la création d'une ferme-auberge"
1097,"Le syndicat Unsa RATP et l'association SOS Usagers ont mené lundi des opérations de tractage pour dénoncer la situation, qui pose de nombreux problèmes de sécur"
1098,La doyenne des Français Lucile Randon est devenue religieuse à 40 ans après avoir été gouvernante à Marseille et institutrice à Versailles.
1099,"La souveraine a assisté au défilé de Richard Quinn à qui elle a remis le premier prix ""Queen Elizabeth II Award for British Design""."
1100,"Nabil al-Quaety a été tué par des hommes armés qui se trouvaient dans sa voiture, peu après avoir quitté son domicile."
1101,"L'argent public n'a pas vocation à financer des services à domicile de confort des personnes aisées, comme un jardinier, un coach sportif ou un secrétaire"
1102,L'ancien président du Front national évoque peu sa fille Marine dans le premier tome des Mémoires de Jean-Marie Le Pen.
1103,"Le sifflement du ciel californien a provoqué une drôle de mélodie dans les rues de San Francisco, rapporte The Guardian."
1104,L'ex-candidate à la mairie de Paris a accordé une interview exclusive à M6.
1105,"L'ambassadeur du Royaume-Uni à Tel-Aviv, Abdelaziz Du Wei, est décédé dans la nuit de lundi à mardi, a annoncé la"
1106,"L'homme de 53 ans aurait tenté d'organiser une séance photo de « nus érotiques » avec 3 sœurs âgées de 8, 10 et 12 ans."
1107,L'homme qui a fait la macabre découverte était parti à sa recrue.
1108,"L'ex-président de SOS Homophobie, Yohann Roszéwitch, a relayé sur Twitter un tag tagué ""enculé de nègre en"
1109,Le président de la République François Hollande s'est exprimé lors d'une visite-conférence organisée par le ministère de la Culture et de l'Écon
1110,Le Premier ministre n'est pas contaminé par le Covid-19. Il a réalisé un second test négatif.
1111,"Après une assemblée générale vendredi matin qui avait voté la levée d'une ""majorité"" de leurs points de blocage, le mouvement a décidé de lever progress progress"
1112,Un Italien âgé d'une trentaine d'années est mort dans un accident de parapente lundi 5 août aux Deux-Alpes.
1113,Le secrétaire d'État chargé des Relations avec le Parlement était invité pour réagir à l'entretien du secrétaire d'État chargé des Relations avec le
1114,Deux surveillants ont été agressés jeudi 20 juin au centre pénitentiaire du Havre par un détenu condamné pour des faits de terrorisme.
1115,"Le ministre des Affaires étrangères iranien, Mohammad Javad Zarif, est en visite à Biarritz pour le sommet du G7 sur le nucléaire iranien,"
1116,"Incarcéré depuis trois mois et hospitalisé depuis le 12 décembre, l'édile de Levallois-Perret a été transporté dans un service réservé aux déten"
1117,L'autopsie réalisée samedi a révélé que Laureline Garcia-Bertaux a été étranglée.
1118,"Le nombre de patients en réanimation, indicateur important de la pression sur le système hospitalier, poursuit de son côté sa décrue."
1119,"Selon un sondage Ipsos/Sopra Steria pour France Télévisions, 46% des Français sont prêts à aller voter dimanche aux élections européennes."
1120,"La chancelière allemande Angela Merkel a qualifié d'""attentat"" la fusillade survenue à Halle mercredi, tandis que de nouveaux détails viennent affiner"
1121,Le premier réacteur de la centrale nucléaire de Fessenheim a vu sa procédure d'arrêt définitive lancée comme prévue.
1122,"George Floyd a été tué lors de son interpellation par des policiers, dont un Américain d'origine asiatique."
1123,Le drame a eu lieu dans un logement du quartier de la Nétreville.
1124,Cette arrestation fait partie d'un vaste coup de filet réalisé dans plusieurs pays européens à l'initiative des autorités italiennes.
1125,Le nouveau siège du Parti socialiste à Ivry-sur-Seine (Val-de-Marne) accueillera une université de rentrée dès le lendemain de son inaugura
1126,"La Bretonne Jacline Mouraud a pris ses distances avec le mouvement des ""gilets jaunes"" et s'interroge sur son avenir."
1127,"Un peu après 17h30, des volutes de fumée blanche sont apparues dans le ciel californien. Les services d'urgences ont été débord"
1128,"La Première dame a tenu à exprimer ""toute sa solidarité"" à l'égard de la jeune femme, qui accuse le réalisateur Christophe Ruggia"
1129,L'exécutif a annoncé la réduction de 90 à 80 km/h de la vitesse maximale autorisée sur 400.000 km de routes secondaires à double sens sans sépara
1130,Une association de cyclistes bretons organise le même jour à Saint-Brieuc dans les Côtes-d'Armor une contre-manifestation à vélo pour faire
1131,"Le décès d'un jeune homme de 19 ans, tué par un Afghan d'une trentaine d'années à la gare routière de Villeurban"
1132,Une étude américaine pointe les différences de réponse immunitaire entre hommes et femmes au Covid-19.
1133,"Un groupe d'ambassadeurs de Miami Beach s'est rendu sur la plage de Miami Beach, dans le sud-est de la ville, pour rappeler aux visiteurs qu'ils"
1134,Le ministère de l'Intérieur a annoncé mardi qu'une centaine de zones touristiques et de rues parisiennes étaient concernées par le Covid-19 à l'
1135,La chanteuse québécoise Céline Dion a annoncé qu'elle s'engageait pour la sauvegarde des forêts tropicales.
1136,"Laurent Berger, ministre de l'Économie et des Finances, revient sur la polémique qui oppose l'exécutif et les syndicats depuis"
1137,M6 retransmettra la huitième saison de Top Chef sur M6. Le programme phare est de retour.
1138,Le trafic ferroviaire sera très perturbé la semaine prochaine.
1139,"Le chef de l'Etat, François Hollande, s'est exprimé lors d'un entretien au Journal du dimanche (JDD) à l'occasion du second"
1140,Le chef de l'État s'est rendu sur les terres du général de Gaulle à Colombey-les-Deux-Églises (Haute-Mar
1141,"Roberto, un médecin italien de 28 ans, est en mission en Italie pour lutter contre la pandémie de Covid-19. Il est en mission à Crema, dans"
1142,"Sur les six premiers mois de l'année, les autorités recensent neuf morts de moins qu'au premier semestre 2018."
1143,"Le restaurateur Eric Poezevara a ouvert un restaurant à Copenhague, dans la banlieue de Copenhague, dans le sillage de l'Ecole"
1144,Les autorités péruviennes ont annoncé des mesures pour fournir des bouteilles d'oxygène le plus vite possible.
1145,Le local du député des Yvelines Didier Baichère a été tagué ce lundi matin.
1146,Le gouvernement a voté le gel des aides au logement qui ne seront pas revalorisées le 1er octobre prochain alors qu'elles l'avaient toujours été jusqu'
1147,"La présence de Listeria monocytogènes, bactérie responsable de la listériose, dans les produits mis en cause, a provoqué la colère des consommateurs"
1148,"Greta Thunberg est connue pour ses expositions et ses expositions médiatiques, selon un sondage BVA pour Orange."
1149,L'administrateur judiciaire de l'Olympique de Marseille a annoncé jeudi la liquidation de l'entreprise de Liège en Belgique.
1150,"La présidente LR de la Région des Pays de Loire a lancé un ""gros coup de colère"" contre les grévistes, ce mardi matin sur RTL."
1151,"Le Nobel de la paix a été attribué au Premier ministre éthiopien Abiy Ahmed, artisan d'une réconciliation spectaculaire entre son pays et l'É"
1152,Le ministre de l'Education Jean-Michel Blanquer a annoncé jeudi 18 juin que les écoles et collèges rouvriraient pour tous à compter du 22 juin.
1153,"Mahmoud Moussavi Majd a été exécuté lundi matin pour espionnage, a annoncé la justice iranienne."
1154,"Le zoo d'Afrique de l'Ouest d'Afrique de l'Ouest a annoncé mercredi la naissance d'un tigreau, baptisé ""Pandemia"" et"
1155,"L'ex-ministre de la Famille regrette ""un relâchement quantitatif au fil des nominations"" au sein du gouvernement entre 2017 et 2020."
1156,"Invité du journal de 13 Heures de TF1 ce vendredi 13 mars, Édouard Philippe a annoncé que les rassemblements de plus de 100 personnes seraient désormais interdit"
1157,"Le ministre britannique des Affaires étrangères Boris Johnson a estimé jeudi que les Britanniques devaient ""respecter leurs obligations"" et "" fournir une alternative"" à la loi"
1158,"Le palmarès de l'édition 2020 des Pulitzer a été décerné mercredi à Donald Trump. Le magazine ""The New York Times"" et le site d'information"
1159,L'élue du VIIe arrondissement de Paris publie un texte dans lequel elle dresse un bilan négatif de deux décennies de gouvernance socialiste.
1160,"Un élève du collège Jean-Jacques Rousseau du Pré-Saint-Gervaius, en Seine-Saint-Denis, est venu en cours avec, dans"
1161,L'ancien chef de l'État est séduit par le jeune chef de l'État.
1162,"L'air du temps. Marianne, enseignante de Tunisie, a décidé de se réfugier en Tunisie, où elle espère retrouver ses parents."
1163,"""Notre-Dame, c'est l'âme de Paris"", ""elle est belle, elle est là, elle a tenu"" et ""c'est une forme presque"
1164,"Le président du Sénat, Jean-François Larcher, a estimé mardi que ""l'État de droit était en recul"" sur la question de l'"
1165,"Selon un sondage réalisé par Odoxa pour Franceinfo et Le Figaro publié jeudi 6 décembre, le gouvernement se prépare au pire et craint une nouvelle flambée de violence"
1166,"Edouard Philippe a présenté lundi le bilan des centaines de milliers de propositions citoyennes issues des deux mois de grand débat national lancé face à la crise des ""gilets"
1167,"Dans un entretien au Monde, le directeur général de l'Hôpital Ciotti revient sur la crise sanitaire qui a conduit à la déprogrammation massive des soins hors Co"
1168,La Convention citoyenne pour le climat a rejeté samedi une proposition de réduction du temps de travail à 28 heures hebdomadaires.
1169,Le nombre de paquets de cigarettes vendus chez les buralistes est en chute libre sur le premier semestre 2018.
1170,"Une journée ""d'accueil"" de 250 élèves infirmiers de première année a attiré l'attention de la CGT du Centre hospitalier de la ville, qui s"
1171,L'ancien président de la République s'est exprimé sur France Inter lundi 25 mai.
1172,Le plan canicule de niveau 3 est activé dès ce dimanche par le préfet.
1173,"Le documentaire ""American Utopia"" de Spike Lee a été présenté en première mondiale en streaming sur internet, ainsi que devant un public limité dans quelques salles de Toronto."
1174,Les deux chanteuses se sont croisées sur scène au sein de la troupe de l'opéra-rock Starmania.
1175,"Invitée du talk-show d'Amanda Scott sur France 2, la directrice générale du comité Miss France et ancienne miss a accepté de se confier sur son divorce."
1176,Le nombre de décès depuis le 1er mars s'élève désormais à 26.310.
1177,"Des milliers de personnes ont défilé dans les rues de New York, Washington, Seattle et Los Angeles, trois villes où le couvre-feu a été levé."
1178,"Le géant chinois de l'Internet a décidé de bloquer ses applications sur le territoire indien, deux semaines après un accrochage meurtrier entre les armées indienne"
1179,L'acteur s'est confié au Monde et a notamment évoqué Jean-Paul Belmondo... qu'il n'a pas épargné.
1180,"Alejandro, le fils de l'épidémiologiste, s'est confié sur son état de santé à la fin de sa journée de travail pour retrouver ses amis. Il"
1181,"Édouard Philippe a qualifié de ""grève sauvage"" des agents de la SNCF."
1182,Le romancier américain Liu U U U U U U U U U U U U U U U U U U U U U U U U U U U U U U
1183,L'Organisation mondiale de l'agriculture (OMS) a annoncé mercredi qu'elle allait tester un nouveau vaccin pour l'épidémie de cancérodéficience
1184,"Un professeur de médecine pakistanais est décédé dans la nuit de vendredi à samedi, au Pakistan, après avoir subi des symptômes d'un cancer, a annoncé"
1185,"La pandémie de Covid-19 a bouleversé l'esprit des scientifiques, mais aussi les esprits. C'est ce que révèle une enquête menée"
1186,L'ex-ministre de la Transition écologique aurait utilisé ses frais de mandat de député de Loire-Atlantique pour payer une partie de ses cotisations d'élu
1187,Le CSA a ouvert une procédure d'instruction contre la chaîne C8 après la diffusion d'une séquence où Laurent Baffie remonte le bas de la robe
1188,"Le ministre de la Transition écologique et solidaire succède à Nicolas Hulot, qui avait brutalement démissionné la semaine précédente."
1189,Le ministère de l'Intérieur avait mis en garde contre la tentation des départs en vacances.
1190,Une enquête du Monde au plus près du personnel des Ehpad illustre la grande appréhension qui règne dans les couloirs des établissements spécialisés.
